{
  "$schema": "https://json-schema.org/draft/2020-12/schema",
  "$id": "https://simple-compute-market.dev/schemas/capacity-action-result-v2.json",
  "title": "SCM one-shot capacity action result",
  "type": "object",
  "additionalProperties": false,
  "required": [
    "schema_version", "action_result_id", "action_id", "action_sha256",
    "actor_slot", "release_id", "attempt", "invoked_at", "terminal_at",
    "result_kind", "emission_count", "terminal_payload_sha256", "failure_code"
  ],
  "properties": {
    "schema_version": {"const": 2},
    "action_result_id": {"type": "string", "pattern": "^[a-z0-9][a-z0-9-]{0,127}$"},
    "action_id": {"type": "string", "pattern": "^[a-z0-9][a-z0-9-]{0,127}$"},
    "action_sha256": {"$ref": "#/$defs/digest"},
    "actor_slot": {"type": "string", "pattern": "^(?:buyer|seller)-[1-9][0-9]*$"},
    "release_id": {"type": "string", "pattern": "^[a-z0-9][a-z0-9-]{0,127}$"},
    "attempt": {"const": 1},
    "invoked_at": {"$ref": "#/$defs/timestamp"},
    "terminal_at": {"$ref": "#/$defs/timestamp"},
    "result_kind": {"enum": ["emitted", "rejected-before-emission"]},
    "emission_count": {"type": "integer", "minimum": 0, "maximum": 1},
    "terminal_payload_sha256": {
      "oneOf": [
        {"type": "null"},
        {"$ref": "#/$defs/digest"}
      ]
    },
    "failure_code": {
      "oneOf": [
        {"type": "null"},
        {
          "enum": [
            "authority-changed", "payload-changed", "selection-changed",
            "runtime-binding-changed", "wrapper-changed", "duplicate-release",
            "unauthorized-retry", "actor-exited", "emission-failed"
          ]
        }
      ]
    }
  },
  "allOf": [
    {
      "if": {"properties": {"result_kind": {"const": "emitted"}}, "required": ["result_kind"]},
      "then": {
        "properties": {
          "emission_count": {"const": 1},
          "terminal_payload_sha256": {"$ref": "#/$defs/digest"},
          "failure_code": {"type": "null"}
        }
      }
    },
    {
      "if": {"properties": {"result_kind": {"const": "rejected-before-emission"}}, "required": ["result_kind"]},
      "then": {
        "properties": {
          "emission_count": {"const": 0},
          "terminal_payload_sha256": {"type": "null"},
          "failure_code": {"type": "string"}
        }
      }
    }
  ],
  "$defs": {
    "digest": {"type": "string", "pattern": "^[0-9a-f]{64}$"},
    "timestamp": {
      "type": "string",
      "format": "date-time",
      "pattern": "^[0-9]{4}-[0-9]{2}-[0-9]{2}T[0-9]{2}:[0-9]{2}:[0-9]{2}(?:\\.[0-9]+)?Z$"
    }
  }
}
